{
  "schema_version": "1.0",
  "tool": "github-actions-deprecation-preflight",
  "tool_version": "0.1.1",
  "version": "0.1.1",
  "status": "warning",
  "scanned_files": 3,
  "active_rule_count": 7,
  "finding_count": 6,
  "findings": [
    {
      "file": ".github/actions/local-action/action.yml",
      "line": 3,
      "rule_id": "local-action-node16",
      "severity": "high",
      "signal": "using: node16",
      "why": "Local JavaScript actions running on Node 16 are a runtime deprecation risk.",
      "fix": "Move the local action runtime to node20/node24 as supported, rebuild dependencies, and test on a branch.",
      "fingerprint": "accb8ee2b1019e38"
    },
    {
      "file": ".github/workflows/ci.yml",
      "line": 7,
      "rule_id": "checkout-v3",
      "severity": "medium",
      "signal": "- uses: actions/checkout@v3",
      "why": "Older checkout major versions can lag runtime/security maintenance.",
      "fix": "Upgrade to actions/checkout@v4 and verify submodule/LFS/token behavior if used.",
      "fingerprint": "a964accd5c637437"
    },
    {
      "file": ".github/workflows/ci.yml",
      "line": 8,
      "rule_id": "cache-v3",
      "severity": "medium",
      "signal": "- uses: actions/cache@v3",
      "why": "Older cache major versions are recurring deprecation/migration hotspots.",
      "fix": "Upgrade to actions/cache@v4 and verify cache key/restore behavior in a non-release branch.",
      "fingerprint": "b89459a6523a7bbb"
    },
    {
      "file": ".github/workflows/ci.yml",
      "line": 12,
      "rule_id": "upload-artifact-v3",
      "severity": "high",
      "signal": "- uses: actions/upload-artifact@v3",
      "why": "upload-artifact v3 is retired/deprecated; workflows should move to the current major.",
      "fix": "Upgrade to actions/upload-artifact@v4 and review changed artifact behavior, overwrite/merge assumptions, and retention settings.",
      "fingerprint": "e167aaebfc5145eb"
    },
    {
      "file": "docs/snippet.md",
      "line": 2,
      "rule_id": "download-artifact-v3",
      "severity": "high",
      "signal": "- uses: actions/download-artifact@v3",
      "why": "download-artifact v3 is retired/deprecated; workflows should move to the current major.",
      "fix": "Upgrade to actions/download-artifact@v4 and verify artifact naming/path assumptions.",
      "fingerprint": "de4f3ab883af1db6"
    },
    {
      "file": "docs/snippet.md",
      "line": 3,
      "rule_id": "setup-node-v3",
      "severity": "medium",
      "signal": "- uses: actions/setup-node@v3",
      "why": "Older setup-node major versions can lag runtime/security maintenance.",
      "fix": "Upgrade to actions/setup-node@v4 and verify node-version/cache behavior.",
      "fingerprint": "e8fea402716b299a"
    }
  ],
  "summary_by_severity": {
    "high": 3,
    "medium": 3
  },
  "summary_by_rule": {
    "local-action-node16": 1,
    "checkout-v3": 1,
    "cache-v3": 1,
    "upload-artifact-v3": 1,
    "download-artifact-v3": 1,
    "setup-node-v3": 1
  },
  "summary": {
    "scanned_files": 3,
    "active_rule_count": 7,
    "finding_count": 6,
    "summary_by_severity": {
      "high": 3,
      "medium": 3
    },
    "summary_by_rule": {
      "local-action-node16": 1,
      "checkout-v3": 1,
      "cache-v3": 1,
      "upload-artifact-v3": 1,
      "download-artifact-v3": 1,
      "setup-node-v3": 1
    }
  },
  "metadata": {
    "privacy": "local-only; no GitHub API, token, network call, source upload, or telemetry"
  },
  "notes": [
    "Read-only local scan; no GitHub API calls or uploads.",
    "Prototype rules are conservative and should be reviewed against official action changelogs before automated migrations."
  ]
}
